{"audit_plan":{"digest_sha256":"27bcc3de8b2badc06c59d7d68348b3aaa3c66ae24847e5d06366b4700175b51b","id":"rcid:v1:scan-plan-revision:h:jcs-sha256-v1:8c7e6db88bd75b6458eb67c5a5fa0fc4a93b13bb5af27e2ad381210f1dc6c639","path":"semantic-corpus/research/regex-semantic-universe-adversarial-plan-2026-09-08.v1.json"},"candidates":[{"blocking":false,"candidate_class":"facet/dimension","candidate_id":"rcid:v1:candidate:u7:01a07d96-a5ba-7bea-b8ca-0f58d7702328","candidate_key":"candidate.facet.complexity-guarantee","current_corpus_relationship":"Compared against the researched successor snapshot and its carried operation/modifier/interaction authorities.","description":"Evaluate Complexity guarantee as a first-class semantic dimension.","discovered_by":"prior-candidate-revalidation","disposition":"accept-as-facet","downstream_consequence":"The later obligation derivation consumes this disposition without changing the predecessor denominator here.","evidence_source_ids":["re2-readme","semantic-obligation-taxonomy"],"identity_consequence":"A new typed assigned identity is allocated where the accepted disposition creates a canonical entity.","implementation_consequence":"Represented in the successor semantic architecture.","origin":"predecessor-ledger","rationale":"Primary authority establishes a materially distinct canonical contract.","renewed_evidence":"Rechecked against the expanded source set, operation/facet attacks, test-corpus scan, and overcount review; no new primary evidence changed this terminal disposition.","review_status":"retained-after-adversarial-review","scientific_distinctness":"Accepted only when the candidate changes an observable language, operation, result, lifecycle, guarantee, or authority boundary rather than naming a vendor spelling."},{"blocking":false,"candidate_class":"facet/dimension","candidate_id":"rcid:v1:candidate:u7:01a07d96-a5ba-7eee-af80-7dd6a43fd896","candidate_key":"candidate.facet.phase","current_corpus_relationship":"Compared against the researched successor snapshot and its carried operation/modifier/interaction authorities.","description":"Evaluate Semantic phase as a first-class semantic dimension.","discovered_by":"prior-candidate-revalidation","disposition":"accept-as-facet","downstream_consequence":"The later obligation derivation consumes this disposition without changing the predecessor denominator here.","evidence_source_ids":["pcre2-pattern","semantic-obligation-taxonomy"],"identity_consequence":"A new typed assigned identity is allocated where the accepted disposition creates a canonical entity.","implementation_consequence":"Represented in the successor semantic architecture.","origin":"predecessor-ledger","rationale":"Primary authority establishes a materially distinct canonical contract.","renewed_evidence":"Rechecked against the expanded source set, operation/facet attacks, test-corpus scan, and overcount review; no new primary evidence changed this terminal disposition.","review_status":"retained-after-adversarial-review","scientific_distinctness":"Accepted only when the candidate changes an observable language, operation, result, lifecycle, guarantee, or authority boundary rather than naming a vendor spelling."},{"blocking":false,"candidate_class":"facet/dimension","candidate_id":"rcid:v1:candidate:u7:01a07d96-a5ba-7cb5-bd41-892989b937d2","candidate_key":"candidate.facet.security-context","current_corpus_relationship":"Compared against the researched successor snapshot and its carried operation/modifier/interaction authorities.","description":"Evaluate Security context as a first-class semantic dimension.","discovered_by":"prior-candidate-revalidation","disposition":"accept-as-facet","downstream_consequence":"The later obligation derivation consumes this disposition without changing the predecessor denominator here.","evidence_source_ids":["re2-readme","semantic-obligation-taxonomy"],"identity_consequence":"A new typed assigned identity is allocated where the accepted disposition creates a canonical entity.","implementation_consequence":"Represented in the successor semantic architecture.","origin":"predecessor-ledger","rationale":"Primary authority establishes a materially distinct canonical contract.","renewed_evidence":"Rechecked against the expanded source set, operation/facet attacks, test-corpus scan, and overcount review; no new primary evidence changed this terminal disposition.","review_status":"retained-after-adversarial-review","scientific_distinctness":"Accepted only when the candidate changes an observable language, operation, result, lifecycle, guarantee, or authority boundary rather than naming a vendor spelling."},{"blocking":false,"candidate_class":"canonical feature","candidate_id":"rcid:v1:candidate:u7:01a07d96-a5ba-76bf-8148-0d237a2a93ac","candidate_key":"candidate.feature.capture-tree","current_corpus_relationship":"Compared against the researched successor snapshot and its carried operation/modifier/interaction authorities.","description":"Tree-shaped capture structure distinct from flat history.","discovered_by":"prior-candidate-revalidation","disposition":"defer-to-oracle-adjudication","downstream_consequence":"Oracle, applicability, claims and adjudication architecture","evidence_source_ids":["dotnet-groups","swift-regex-type"],"identity_consequence":"No accepted scientific identity is retired or reused.","implementation_consequence":"No duplicate canonical semantic entity is minted in this snapshot.","origin":"predecessor-ledger","rationale":"The reviewed evidence places this concept in an existing entity, a narrower manifestation/profile, or a later authority layer.","renewed_evidence":"Rechecked against the expanded source set, operation/facet attacks, test-corpus scan, and overcount review; no new primary evidence changed this terminal disposition.","review_status":"retained-after-adversarial-review","scientific_distinctness":"Accepted only when the candidate changes an observable language, operation, result, lifecycle, guarantee, or authority boundary rather than naming a vendor spelling."},{"blocking":false,"candidate_class":"canonical feature","candidate_id":"rcid:v1:candidate:u7:01a07d96-a5ba-7a02-a3f6-ead6f6455e5d","candidate_key":"candidate.feature.captured-substring-assertion","current_corpus_relationship":"Compared against the researched successor snapshot and its carried operation/modifier/interaction authorities.","description":"Evaluate Captured-substring assertion as a canonical semantic concept.","discovered_by":"prior-candidate-revalidation","disposition":"accept-canonical","downstream_consequence":"The later obligation derivation consumes this disposition without changing the predecessor denominator here.","evidence_source_ids":["pcre2-pattern"],"identity_consequence":"A new typed assigned identity is allocated where the accepted disposition creates a canonical entity.","implementation_consequence":"Represented in the successor semantic architecture.","origin":"predecessor-ledger","rationale":"Primary authority establishes a materially distinct canonical contract.","renewed_evidence":"Rechecked against the expanded source set, operation/facet attacks, test-corpus scan, and overcount review; no new primary evidence changed this terminal disposition.","review_status":"retained-after-adversarial-review","scientific_distinctness":"Accepted only when the candidate changes an observable language, operation, result, lifecycle, guarantee, or authority boundary rather than naming a vendor spelling."},{"blocking":false,"candidate_class":"canonical feature","candidate_id":"rcid:v1:candidate:u7:01a07d96-a5ba-75c1-9b71-54365d7d0c63","candidate_key":"candidate.feature.cursor-retention","current_corpus_relationship":"Compared against the researched successor snapshot and its carried operation/modifier/interaction authorities.","description":"Retain or expose the next search cursor.","discovered_by":"prior-candidate-revalidation","disposition":"already-covered","downstream_consequence":"The later obligation derivation consumes this disposition without changing the predecessor denominator here.","evidence_source_ids":["java-matcher","tcl-regex"],"identity_consequence":"No accepted scientific identity is retired or reused.","implementation_consequence":"No duplicate canonical semantic entity is minted in this snapshot.","origin":"predecessor-ledger","rationale":"The reviewed evidence places this concept in an existing entity, a narrower manifestation/profile, or a later authority layer.","renewed_evidence":"Rechecked against the expanded source set, operation/facet attacks, test-corpus scan, and overcount review; no new primary evidence changed this terminal disposition.","review_status":"retained-after-adversarial-review","scientific_distinctness":"Accepted only when the candidate changes an observable language, operation, result, lifecycle, guarantee, or authority boundary rather than naming a vendor spelling."},{"blocking":false,"candidate_class":"canonical feature","candidate_id":"rcid:v1:candidate:u7:01a07d96-a5ba-7ccf-873a-b9f7210635a5","candidate_key":"candidate.feature.empty-language-atom","current_corpus_relationship":"Compared against the researched successor snapshot and its carried operation/modifier/interaction authorities.","description":"Evaluate Empty-language atom as a canonical semantic concept.","discovered_by":"prior-candidate-revalidation","disposition":"accept-canonical","downstream_consequence":"The later obligation derivation consumes this disposition without changing the predecessor denominator here.","evidence_source_ids":["lucene-regexp","smtlib-unicode-strings"],"identity_consequence":"A new typed assigned identity is allocated where the accepted disposition creates a canonical entity.","implementation_consequence":"Represented in the successor semantic architecture.","origin":"predecessor-ledger","rationale":"Primary authority establishes a materially distinct canonical contract.","renewed_evidence":"Rechecked aga